{
  "taskId": "00000000-0000-4000-8000-000000000006",
  "attempt": 1,
  "callbackId": "00000000-0000-4000-8000-000000000007",
  "callbackToken": "fixture-callback-token-not-a-secret-0003",
  "payloadHash": "cccccccccccccccccccccccccccccccccccccccccccccccccccccccccccccccc",
  "outcome": "FAILED",
  "errorCode": "MODEL_UNAVAILABLE",
  "correlationId": "00000000-0000-4000-8000-000000000008"
}
