{
  "taskId": "task001",
  "attempt": 1,
  "callbackId": "callback002",
  "callbackToken": "fixture-callback-token-not-a-secret-0002",
  "payloadHash": "bbbbbbbbbbbbbbbbbbbbbbbbbbbbbbbbbbbbbbbbbbbbbbbbbbbbbbbbbbbbbbbb",
  "outcome": "FAILED",
  "errorCode": "MODEL_UNAVAILABLE",
  "correlationId": "00000000-0000-4000-8000-000000000005"
}

