{
  "taskId": "task006",
  "attempt": 1,
  "callbackId": "callback003",
  "callbackToken": "fixture-callback-token-not-a-secret-0003",
  "payloadHash": "cccccccccccccccccccccccccccccccccccccccccccccccccccccccccccccccc",
  "outcome": "FAILED",
  "errorCode": "MODEL_UNAVAILABLE",
  "correlationId": "00000000-0000-4000-8000-000000000008"
}

